title	date	location	filename	url
hotel victoria and beach, misdroy, pomerania, germany  (i.e., międzyzdroje, poland)	1890	Germany	2002713990.jpg	http://www.loc.gov/item/2002713990/
maria lake, carniola, austro-hungary	1890	Austro-Hungary	2002710715.jpg	http://www.loc.gov/item/2002710715/
cape trinity on the saguenay river	1901	US	2008679512.jpg	http://www.loc.gov/item/2008679512/
from the sea garden, the harbor, kiel, schleswig-holstein, germany	1890	Germany	2002720659.jpg	http://www.loc.gov/item/2002720659/
lugano, from san salvatore, tessin, switzerland	1890	Switzerland	2001703233.jpg	http://www.loc.gov/item/2001703233/
council building, constance (i.e. konstanz), baden, germany	1890	Germany	2002713569.jpg	http://www.loc.gov/item/2002713569/
kariye mosque, constantinople, turkey	1890	Turkey	2003653114.jpg	http://www.loc.gov/item/2003653114/
st. valentine on the danube, haide with haidersee and ortergruppe, tyrol, austro-hungary	1890	Austro-Hungary	2002711104.jpg	http://www.loc.gov/item/2002711104/
st. lambert place, liège, belgium	1890	Belgium	2001697947.jpg	http://www.loc.gov/item/2001697947/
scarborough, the children's corner, yorkshire, england	1890	UK	2002708325.jpg	http://www.loc.gov/item/2002708325/
the limmatquay, with polytechnic, zurich, switzerland	1890	Switzerland	2001703376.jpg	http://www.loc.gov/item/2001703376/
the harbor from the lighthouse, algiers, algeria	1899	Algeria	2001697802.jpg	http://www.loc.gov/item/2001697802/
shanklin, chine, isle of wight, england	1890	UK	2002708260.jpg	http://www.loc.gov/item/2002708260/
the castle yard, heidelberg, baden, germany	1890	Germany	2002713586.jpg	http://www.loc.gov/item/2002713586/
henley on thames, red lion hotel, england	1890	UK	2002696949.jpg	http://www.loc.gov/item/2002696949/
landro, the three spires (i.e., drei zinnen), tyrol, austro-hungary	1890	Austro-Hungary	2002711041.jpg	http://www.loc.gov/item/2002711041/
the bay, gardone, lake garda, italy	1890	Italy	2001700809.jpg	http://www.loc.gov/item/2001700809/
the sphinx, apostle islands, lake superior	1898	US	2008678246.jpg	http://www.loc.gov/item/2008678246/
from the belfrey, amiens, france	1890	France	2001697551.jpg	http://www.loc.gov/item/2001697551/
the cliffs, dover, england	1890	UK	2002696725.jpg	http://www.loc.gov/item/2002696725/
the rudelsburg, kosen, thuringia, germany	1890	Germany	2002720589.jpg	http://www.loc.gov/item/2002720589/
dunmore, iii. county waterford, ireland	1890	Ireland	2002717300.jpg	http://www.loc.gov/item/2002717300/
high street, battle, england	1890	UK	2002696375.jpg	http://www.loc.gov/item/2002696375/
l'ile barbe, lyons, france	1890	France	2001698431.jpg	http://www.loc.gov/item/2001698431/
canal and gondolas, venice, italy	1890	Italy	2001701074.jpg	http://www.loc.gov/item/2001701074/
new harbor from the lighthouse, bremerhafen, hanover (i.e. hannover), germany	1890	Germany	2002713713.jpg	http://www.loc.gov/item/2002713713/
the cathedral, lucerne, switzerland	1890	Switzerland	2001703049.jpg	http://www.loc.gov/item/2001703049/
thèbes, les colosses de memnon	1890	Egypt	2017656989.jpg	http://www.loc.gov/item/2017656989/
bangor from anglesey, wales	1890	Wales	2001703419.jpg	http://www.loc.gov/item/2001703419/
mission san antonio, general view	1898	na	2008678179.jpg	http://www.loc.gov/item/2008678179/
pioton [i.e., picton] viaduct	1890	Australia	2017657731.jpg	http://www.loc.gov/item/2017657731/
arlberg railway, trisanna viaduct and castle weisberg, tyrol, austro-hungary	1890	Austro-Hungary	2002710996.jpg	http://www.loc.gov/item/2002710996/
cliff palace, mesa verde, general view	1898	na	2008678196.jpg	http://www.loc.gov/item/2008678196/
"""maria theresia,"" smoking cabin, first class, north german lloyd, royal mail steamer"	1890	Germany	2002720835.jpg	http://www.loc.gov/item/2002720835/
the harbor (free port), bremen, germany	1890	Germany	2002713656.jpg	http://www.loc.gov/item/2002713656/
engelberg valley, general view, bernese oberland, switzerland	1890	Switzerland	2001701131.jpg	http://www.loc.gov/item/2001701131/
the fort, margate, england	1890	UK	2002697071.jpg	http://www.loc.gov/item/2002697071/
semmering railway to krausel krause (i.e., krauselklause), styria, austro-hungary	1890	Austro-Hungary	2002710979.jpg	http://www.loc.gov/item/2002710979/
ebernburg (i.e., bad münster am stein-ebernburg) nahethal, rhenish prussia, germany	1890	Germany	2002714039.jpg	http://www.loc.gov/item/2002714039/
harbor, san sebastián, spain	1890	Spain	2001699365.jpg	http://www.loc.gov/item/2001699365/
port said, entrée du canal de suez	1890	Egypt	2017656966.jpg	http://www.loc.gov/item/2017656966/
general view, fecamp, france	1890	France	2001698124.jpg	http://www.loc.gov/item/2001698124/
naerofjord (i.e., nærøyfjord) from gudvangen, sognefjord, norway	1890	Norway	2001700720.jpg	http://www.loc.gov/item/2001700720/
ashford, old mill, derbyshire, england	1890	UK	2002696660.jpg	http://www.loc.gov/item/2002696660/
landing-place for steamers, altstadt, dresden, saxony, germany	1890	Germany	2002720566.jpg	http://www.loc.gov/item/2002720566/
hintersee, general view, upper bavaria, germany	1890	Germany	2002696230.jpg	http://www.loc.gov/item/2002696230/
le palais de beaux-arts, exposition universelle, 1889, paris, france	1889	France	2001698574.jpg	http://www.loc.gov/item/2001698574/
thornwick bay, yorkshire, england	1890	UK	2002708333.jpg	http://www.loc.gov/item/2002708333/
st. gertrude church, louvain, belgium	1890	Belgium	2001697951.jpg	http://www.loc.gov/item/2001697951/
sella joch and langkofl, tyrol, austro-hungary	1890	Austro-Hungary	2002711112.jpg	http://www.loc.gov/item/2002711112/
irvine from the river, scotland	1890	Scotland	2001706027.jpg	http://www.loc.gov/item/2001706027/
resting bedouins and the grand pyramid, cairo, egypt	1890	Egypt	2003653102.jpg	http://www.loc.gov/item/2003653102/
locarno, view of the lake, tessin, switzerland	1890	Switzerland	2001703225.jpg	http://www.loc.gov/item/2001703225/
lauterbrunnen valley and murren railway, bernese oberland, switzerland	1890	Switzerland	2001701218.jpg	http://www.loc.gov/item/2001701218/
bridlington, convalescent home, yorkshire, england	1890	UK	2002708299.jpg	http://www.loc.gov/item/2002708299/
statue of maisonneuve, montreal	1901	Canada	2008679504.jpg	http://www.loc.gov/item/2008679504/
bad kissengen (i.e. bad kissingen) railway station and the bodenlaube, seen from the altenberg, bavaria, germany	1890	Germany	2002696119.jpg	http://www.loc.gov/item/2002696119/
girl of sarajevo, bosnia, austro-hungary	1890	Austro-Hungary	2002710703.jpg	http://www.loc.gov/item/2002710703/
wien. stephansdom	1890	Austro-Hungary	2017659113.jpg	http://www.loc.gov/item/2017659113/
casino and pier, heringsdorf (i.e., seebad heringsdorf), pomerania, germany	1890	Germany	2002713986.jpg	http://www.loc.gov/item/2002713986/
from the gursuff (i.e., gurzuf), road, jalta, (i.e., yalta), the crimea, russia, (i.e., ukraine)	1890	Ukraine	2001697402.jpg	http://www.loc.gov/item/2001697402/
lausanne, view of the montriond, geneva lake, switzerland	1890	Switzerland	2001702434.jpg	http://www.loc.gov/item/2001702434/
the water tower, chester, england	1890	UK	2002696549.jpg	http://www.loc.gov/item/2002696549/
general view, ahlbeck, pomerania, germany	1890	Germany	2002713969.jpg	http://www.loc.gov/item/2002713969/
general view, tréport, france	1890	France	2001698718.jpg	http://www.loc.gov/item/2001698718/
the roman arch and the church, aix, france	1890	France	2001697547.jpg	http://www.loc.gov/item/2001697547/
castle geyser, yellowstone national park	1898	na	2008678250.jpg	http://www.loc.gov/item/2008678250/
langenfeld, general view, tyrol, austro-hungary	1890	Austro-Hungary	2002711057.jpg	http://www.loc.gov/item/2002711057/
viaduct over ravenna ravine, hollenthal railway, baden, germany	1890	Germany	2002713590.jpg	http://www.loc.gov/item/2002713590/
edgar tower, worcester, england	1890	UK	2002708276.jpg	http://www.loc.gov/item/2002708276/
great mosque in the marine street, algiers, algeria	1899	Algeria	2001697814.jpg	http://www.loc.gov/item/2001697814/
in zeister wood, utrecht, holland	1890	Netherlands	2001699559.jpg	http://www.loc.gov/item/2001699559/
from alpenquay, with alpenquay and zurichberg, zurich, switzerland	1890	Switzerland	2001703360.jpg	http://www.loc.gov/item/2001703360/
interlaken, hotels, bernese oberland, switzerland	1890	Switzerland	2001701189.jpg	http://www.loc.gov/item/2001701189/
templand bridge, cumnock, scotland	1890	Scotland	2001705963.jpg	http://www.loc.gov/item/2001705963/
bombay. pydownee street	1890	India	2017658169.jpg	http://www.loc.gov/item/2017658169/
south shore, southampton, england	1890	UK	2002708108.jpg	http://www.loc.gov/item/2002708108/
camels halting in the desert, holy land	1890	Holy Land	2001699277.jpg	http://www.loc.gov/item/2001699277/
south dome, yosemite valley	1898	US	2008678084.jpg	http://www.loc.gov/item/2008678084/
pontoon bridge from deutz, cologne, the rhine, germany	1890	Germany	2002714081.jpg	http://www.loc.gov/item/2002714081/
old house, hildesheim, hanover, germany	1890	Germany	2002713744.jpg	http://www.loc.gov/item/2002713744/
the grand canal, view ii, venice, italy	1890	Italy	2001701023.jpg	http://www.loc.gov/item/2001701023/
cityscape view looking toward cathedral, florence, italy	1890	Italy	2001700798.jpg	http://www.loc.gov/item/2001700798/
the terrace of the new castle, baden-baden, baden, germany	1890	Germany	2002696322.jpg	http://www.loc.gov/item/2002696322/
general view, monte dore, france	1890	France	2001698466.jpg	http://www.loc.gov/item/2001698466/
tomb of lazarus, bethany, holy land, (i.e. west bank)	1890	Holy Land	2002724964.jpg	http://www.loc.gov/item/2002724964/
quay alex. iii and commercial docks, cherbourg, france	1890	France	2001697639.jpg	http://www.loc.gov/item/2001697639/
sultan mountain, colorado	1898	US	2008679695.jpg	http://www.loc.gov/item/2008679695/
view from schachen, upper bavaria, germany	1890	Germany	2002696288.jpg	http://www.loc.gov/item/2002696288/
the honeycombs, giant's causeway. county antrim, ireland	1890	Ireland	2002717357.jpg	http://www.loc.gov/item/2002717357/
castle, the chapel, goodrich, england	1890	UK	2002696772.jpg	http://www.loc.gov/item/2002696772/
oberammergau with laber, upper bavaria, germany	1890	Germany	2002696267.jpg	http://www.loc.gov/item/2002696267/
the opera house, the inauguration of the opera, paris, france	1890	France	2001698523.jpg	http://www.loc.gov/item/2001698523/
old st. peter, part of the klausenwasser, riesengebirge, germany	1890	Germany	2002720531.jpg	http://www.loc.gov/item/2002720531/
bellagio, general view, lake como, italy	1890	Italy	2001700777.jpg	http://www.loc.gov/item/2001700777/
general view, dartmouth, england	1890	UK	2002696637.jpg	http://www.loc.gov/item/2002696637/
the arena, exterior, nîmes, france	1890	France	2001698489.jpg	http://www.loc.gov/item/2001698489/
hotel des anglais, nice, riviera	1890	France	2001699332.jpg	http://www.loc.gov/item/2001699332/
lucknow. modjibaman	1890	India	2017657623.jpg	http://www.loc.gov/item/2017657623/
general view, miskolez, hungary, austro-hungary	1890	Austro-Hungary	2002710884.jpg	http://www.loc.gov/item/2002710884/
grindelwald, grotto, i, bernese oberland, switzerland	1890	Switzerland	2001701166.jpg	http://www.loc.gov/item/2001701166/
parade place and kaufhaus, karlsruhe, baden, germany	1890	Germany	2002713601.jpg	http://www.loc.gov/item/2002713601/
douglas, the beach, isle of man	1890	UK	2002697026.jpg	http://www.loc.gov/item/2002697026/
calcutta eden garden with burmese pagoda	1890	India	2017658186.jpg	http://www.loc.gov/item/2017658186/
promenade du midi, mentone, riviera	1890	France	2001699298.jpg	http://www.loc.gov/item/2001699298/
glion and dent du midi, geneva lake, switzerland	1890	Switzerland	2001702463.jpg	http://www.loc.gov/item/2001702463/
louvain. l'eglise st. gertrude. les stalles à gauche	1890	Belgium	2017659144.jpg	http://www.loc.gov/item/2017659144/
monte carlo, from fort antoine, monaco (riviera)	1890	Monaco	2002715106.jpg	http://www.loc.gov/item/2002715106/
general view from st. saviour's, moscow, russia	1890	Russia	2001697455.jpg	http://www.loc.gov/item/2001697455/
the old library, yale college	1901	US	2008679553.jpg	http://www.loc.gov/item/2008679553/
cattaro, general view and channel, dalmatia, austro-hungary	1890	Austro-Hungary	2002710754.jpg	http://www.loc.gov/item/2002710754/
chapel, würzburg, bavaria, germany	1890	Germany	2002720618.jpg	http://www.loc.gov/item/2002720618/
sachseln, unterwald, switzerland	1890	Switzerland	2001703272.jpg	http://www.loc.gov/item/2001703272/
toblach lake, tyrol, austro-hungary	1890	Austro-Hungary	2002711145.jpg	http://www.loc.gov/item/2002711145/
milking time, england	1890	UK	2002708364.jpg	http://www.loc.gov/item/2002708364/
the chapel, bruges, belgium	1890	Belgium	2001697906.jpg	http://www.loc.gov/item/2001697906/
zermatt, gorner gorge, valais alps of, switzerland	1890	Switzerland	2001703337.jpg	http://www.loc.gov/item/2001703337/
glentworth sands, weston-super-mare, england	1890	UK	2002708221.jpg	http://www.loc.gov/item/2002708221/
luce ben aben, moorish women preparing couscous, algiers, algeria	1899	Algeria	2001697843.jpg	http://www.loc.gov/item/2001697843/
silverton and sultan mountain, colorado	1901	US	2008678207.jpg	http://www.loc.gov/item/2008678207/
interior of the campo santo, genoa, italy	1890	Italy	2001700848.jpg	http://www.loc.gov/item/2001700848/
lincoln, from s. e., lincoln, england	1890	UK	2002696908.jpg	http://www.loc.gov/item/2002696908/
bosen and mendel, tyrol, austro-hungary	1890	Austro-Hungary	2002711000.jpg	http://www.loc.gov/item/2002711000/
general view, dillenburg, hesse-nassau, germany	1890	Germany	2002713894.jpg	http://www.loc.gov/item/2002713894/
botanical gardens, tiflis, russia, (i.e., tbilisi, georgia)	1890	Russia	2001697510.jpg	http://www.loc.gov/item/2001697510/
lower engadine, vulpera hotel, schweizerhof and bellevue, grisons, switzerland	1890	Switzerland	2001703015.jpg	http://www.loc.gov/item/2001703015/
interior of st. john and st. paul's, venice, italy	1890	Italy	2001701028.jpg	http://www.loc.gov/item/2001701028/
prenjalpe, between mostar and sarajewo, herzegowina, austro-hungary	1890	Austro-Hungary	2002710860.jpg	http://www.loc.gov/item/2002710860/
the zauberhole and the schweizerhaus, niederwald monument, the rhine, germany	1890	Germany	2002714120.jpg	http://www.loc.gov/item/2002714120/
interlaken, the ruins of unspunnen, bernese oberland, switzerland	1890	Switzerland	2001701182.jpg	http://www.loc.gov/item/2001701182/
doon castle from the loch, dalmellington, scotland	1890	Scotland	2001705968.jpg	http://www.loc.gov/item/2001705968/
lumley road, skegness, england	1890	UK	2002708103.jpg	http://www.loc.gov/item/2002708103/
amritsar. golden temple	1890	India	2017658162.jpg	http://www.loc.gov/item/2017658162/
pont-y-pair iv, bettws-y-coed (i.e. betws), wales	1890	Wales	2001703445.jpg	http://www.loc.gov/item/2001703445/
"an ""estufa"", pueblo of taos, n.m."	1898	US	2008678125.jpg	http://www.loc.gov/item/2008678125/
the fountain of elephants, chambéry, france	1890	France	2001697632.jpg	http://www.loc.gov/item/2001697632/
prien on chiemsee, upper bavaria, germany	1890	Germany	2002696283.jpg	http://www.loc.gov/item/2002696283/
high street, guildford, england	1890	UK	2002696779.jpg	http://www.loc.gov/item/2002696779/
royal museum, the court (i.e. bargello museum, the courtyard), florence, italy	1890	Italy	2001700793.jpg	http://www.loc.gov/item/2001700793/
a tunnel, abthal, black forest, baden, germany	1890	Germany	2002696329.jpg	http://www.loc.gov/item/2002696329/
the gate of the street called straight, damascus, holy land, (i.e. syria)	1890	Holy Land	2002724980.jpg	http://www.loc.gov/item/2002724980/
monks' promenade, mont st. michel, france	1890	France	2001698482.jpg	http://www.loc.gov/item/2001698482/
tremont street, boston mass.	1904	US	2008679671.jpg	http://www.loc.gov/item/2008679671/
from water tower, hereford, england	1890	UK	2002696796.jpg	http://www.loc.gov/item/2002696796/
from rigi kanzell, pilatus, switzerland	1890	Switzerland	2001703150.jpg	http://www.loc.gov/item/2001703150/
bannatyne, kyles of bute, scotland	1890	Scotland	2002695010.jpg	http://www.loc.gov/item/2002695010/
castle hill, dunoon, scotland	1890	Scotland	2001705987.jpg	http://www.loc.gov/item/2001705987/
mozart monument, vienna, austro-hungary	1890	Austro-Hungary	2002708416.jpg	http://www.loc.gov/item/2002708416/
general view, èze and st. jean, riviera	1890	France	2001699293.jpg	http://www.loc.gov/item/2001699293/
massena place, nice, riviera	1890	France	2001699339.jpg	http://www.loc.gov/item/2001699339/
dolbadarn castle, llanberis, wales	1890	Wales	2001703500.jpg	http://www.loc.gov/item/2001703500/
colorado. miner's cabin in winter	1898	US	2008678060.jpg	http://www.loc.gov/item/2008678060/
south of india. seringham. town-gate.	1890	India	2017657628.jpg	http://www.loc.gov/item/2017657628/
university, bonn, the rhine, germany	1890	Germany	2002714065.jpg	http://www.loc.gov/item/2002714065/
the hoe, from the rusty anchor, plymouth, england	1890	UK	2002708046.jpg	http://www.loc.gov/item/2002708046/
battle monument, u.s. military academy	1901	US	2008679558.jpg	http://www.loc.gov/item/2008679558/
"""monk"" and preacher's pulpit, helgoland, germany"	1890	Germany	2002713870.jpg	http://www.loc.gov/item/2002713870/
marienplatz, munich, bavaria, germany	1890	Germany	2002696145.jpg	http://www.loc.gov/item/2002696145/
roquefavour aqueduct, marseilles canal, orange, provence, france	1890	France	2001698601.jpg	http://www.loc.gov/item/2001698601/
zittau, towards the jeschken, saxony, germany	1890	Germany	2002720613.jpg	http://www.loc.gov/item/2002720613/
klonthal lake, glarus, switzerland	1890	Switzerland	2001702468.jpg	http://www.loc.gov/item/2001702468/
sark, the coupee, channel islands	1890	UK	2002696515.jpg	http://www.loc.gov/item/2002696515/
il posillipo, naples, italy	1890	Italy	2001700906.jpg	http://www.loc.gov/item/2001700906/
buttermere and crummock water, lake district, england	1890	UK	2002696846.jpg	http://www.loc.gov/item/2002696846/
top capou, (i.e., top kapı) constantinople, turkey	1890	Turkey	2001699440.jpg	http://www.loc.gov/item/2001699440/
scheidegg, jungfrau and silberhorn, bernese oberland, switzerland	1890	Switzerland	2001701244.jpg	http://www.loc.gov/item/2001701244/
castle ruins, granges, valais, switzerland	1890	Switzerland	2001703279.jpg	http://www.loc.gov/item/2001703279/
gornergrat railway, riffelberg hotel and station, valais, alps of, switzerland	1890	Switzerland	2001703296.jpg	http://www.loc.gov/item/2001703296/
arab dancing girls, algiers, algeria	1899	Algeria	2001697848.jpg	http://www.loc.gov/item/2001697848/
kairo, coiffeurs arabes dans la rue	1890	Egypt	2017657444.jpg	http://www.loc.gov/item/2017657444/
toscolana (i.e. toscalano) valley, the valley, lake garda, italy	1890	Italy	2001700843.jpg	http://www.loc.gov/item/2001700843/
general view, lee (devon), england	1890	UK	2002696903.jpg	http://www.loc.gov/item/2002696903/
peat market and great church, haarlem, holland	1890	Netherlands	2001699505.jpg	http://www.loc.gov/item/2001699505/
grindelwald, footbridge and mountain peaks, bernese oberland, switzerland	1890	Switzerland	2001701301.jpg	http://www.loc.gov/item/2001701301/
reichenau, villa wartholz, lower austria, austro-hungary	1890	Austro-Hungary	2002708380.jpg	http://www.loc.gov/item/2002708380/
old weir bridge. killarney. county kerry, ireland	1890	Ireland	2002717425.jpg	http://www.loc.gov/item/2002717425/
st. moritz, village and baths, with piz surlej, grisons, switzerland	1890	Switzerland	2001702487.jpg	http://www.loc.gov/item/2001702487/
luther fountain at riesenhaus, nordhausen, thuringia, germany	1890	Germany	2002720756.jpg	http://www.loc.gov/item/2002720756/
view from wall towards mary's church, lubeck, germany	1890	Germany	2002713935.jpg	http://www.loc.gov/item/2002713935/
the triumphal car, versailles, france	1890	France	2001698744.jpg	http://www.loc.gov/item/2001698744/
monte carlo casino, monaco (riviera)	1890	Monaco	2002707976.jpg	http://www.loc.gov/item/2002707976/
lutterworth church	1890	UK	2017659724.jpg	http://www.loc.gov/item/2017659724/
haddon hall, from terrace steps, derbyshire, england	1890	UK	2002696684.jpg	http://www.loc.gov/item/2002696684/
hercules avenue, altstadt, dresden, saxony, germany	1890	Germany	2002720582.jpg	http://www.loc.gov/item/2002720582/
the ramparts, avignon, provence, france	1890	France	2001698590.jpg	http://www.loc.gov/item/2001698590/
the terrace, aberystwith, wales	1890	Wales	2001703412.jpg	http://www.loc.gov/item/2001703412/
meadowland	1902	US	2008678172.jpg	http://www.loc.gov/item/2008678172/
view from stone pier, morecambe, england	1890	UK	2002697095.jpg	http://www.loc.gov/item/2002697095/
grèce. vue de sparte avec le taygete	1890	Greece	2017658135.jpg	http://www.loc.gov/item/2017658135/
view from e. cliff, teignmouth, england	1890	UK	2002708154.jpg	http://www.loc.gov/item/2002708154/
gottingen hardenberg ruins, hanover, germany	1890	Germany	2002713718.jpg	http://www.loc.gov/item/2002713718/
railway station and pilatus by moonlight, lucerne, switzerland	1890	Switzerland	2001703042.jpg	http://www.loc.gov/item/2001703042/
zara, central cafe, dalmatia, austro-hungary	1890	Austro-Hungary	2002710837.jpg	http://www.loc.gov/item/2002710837/
canal de suez, le lac salé	1890	Egypt	2017656982.jpg	http://www.loc.gov/item/2017656982/
general view from paris hotel, tunis, tunisia	1899	Tunisia	2001699381.jpg	http://www.loc.gov/item/2001699381/
beach, zoppot, west prussia, germany (i.e., sopot, poland)	1890	Germany	2002714032.jpg	http://www.loc.gov/item/2002714032/
thorpe, old reach, norwich, england	1890	UK	2002708011.jpg	http://www.loc.gov/item/2002708011/
view near falls hats, milford track	1890	New Zealand	2017658070.jpg	http://www.loc.gov/item/2017658070/
harbor, tenby, wales	1890	Wales	2001703557.jpg	http://www.loc.gov/item/2001703557/
lintz (i.e., linz), general view, upper austria, austro-hungary	1890	Austro-Hungary	2002708441.jpg	http://www.loc.gov/item/2002708441/
tell's chapel, the lane through the woods near kussnacht, showing the chapel, lake lucerne, switzerland	1890	Switzerland	2001703107.jpg	http://www.loc.gov/item/2001703107/
west bay, rothsay (i.e. rothesay), scotland	1890	Scotland	2002695047.jpg	http://www.loc.gov/item/2002695047/
graz, electrical elevator, styria, austro-hungary	1890	Austro-Hungary	2002710972.jpg	http://www.loc.gov/item/2002710972/
the otis elevating railway, catskill mountains	1902	US	2008679626.jpg	http://www.loc.gov/item/2008679626/
the north pier, blackpool, england	1890	UK	2002696391.jpg	http://www.loc.gov/item/2002696391/
fountain, constantinople, turkey	1890	Turkey	2003653109.jpg	http://www.loc.gov/item/2003653109/
lauterbrunnen valley with staubbach and hotel steinbock, bernese oberland, switzerland	1890	Switzerland	2001701213.jpg	http://www.loc.gov/item/2001701213/
sarindar fountain, bukharest, roumania	1890	Roumania	2001699417.jpg	http://www.loc.gov/item/2001699417/
freiburg, general view, baden, germany	1890	Germany	2002713574.jpg	http://www.loc.gov/item/2002713574/
the beach, gardens and jetty, yarmouth, england	1890	UK	2002708292.jpg	http://www.loc.gov/item/2002708292/
whitby, robin hood's bay, yorkshire, england	1890	UK	2002708338.jpg	http://www.loc.gov/item/2002708338/
tomb of victor emmanuel, rome, italy	1890	Italy	2001700951.jpg	http://www.loc.gov/item/2001700951/
from the pier, new hunstanton, england	1890	UK	2002696811.jpg	http://www.loc.gov/item/2002696811/
sterzing, tyrol, austro-hungary	1890	Austro-Hungary	2002711119.jpg	http://www.loc.gov/item/2002711119/
bruges. la porte d'ostende	1890	Belgium	2017659118.jpg	http://www.loc.gov/item/2017659118/
the russian cathedral and the harbor, helsingfors, russia, i.e., helsinki, finland	1890	Russia	2001697409.jpg	http://www.loc.gov/item/2001697409/
boys college, nelson	1890	New Zealand	2017657805.jpg	http://www.loc.gov/item/2017657805/
tombs of the kings, jerusalem, holy land	1890	Holy Land	2002725016.jpg	http://www.loc.gov/item/2002725016/
castle, iv, chepstow, wales	1890	Wales	2002696542.jpg	http://www.loc.gov/item/2002696542/
alpine pass	1898	US	2008676300.jpg	http://www.loc.gov/item/2008676300/
nordenhofendenstrasse, flensburg, schleswig-holstein, germany	1890	Germany	2002720644.jpg	http://www.loc.gov/item/2002720644/
lower bridge and rathhaus, bamberg, bavaria, germany	1890	Germany	2002696112.jpg	http://www.loc.gov/item/2002696112/
romkerfalls, hartz, germany	1890	Germany	2002713827.jpg	http://www.loc.gov/item/2002713827/
valley of lys and cascade de cocur, luchon, pyrenees, france	1890	France	2001698656.jpg	http://www.loc.gov/item/2001698656/
peasants dancing, bosnia, austro-hungary	1890	Austro-Hungary	2002710708.jpg	http://www.loc.gov/item/2002710708/
invalids' walk, bournemouth, england	1890	UK	2002696407.jpg	http://www.loc.gov/item/2002696407/
the ehrenburg, moselle, valley of, germany	1890	Germany	2002713962.jpg	http://www.loc.gov/item/2002713962/
museum court, toulouse, france	1890	France	2001698713.jpg	http://www.loc.gov/item/2001698713/
old bridge and st. peter's church, gorlitz, silesia, germany	1890	Germany	2002720701.jpg	http://www.loc.gov/item/2002720701/
pinken, scheveningen, holland	1890	Netherlands	2001699552.jpg	http://www.loc.gov/item/2001699552/
general view, limone, lake garda, italy	1890	Italy	2001700814.jpg	http://www.loc.gov/item/2001700814/
richmond, star and garter hotel, england	1890	UK	2002696954.jpg	http://www.loc.gov/item/2002696954/
moorish cafe, tunis, tunisia	1899	Tunisia	2001699397.jpg	http://www.loc.gov/item/2001699397/
bruges. canal et beffroi	1890	Belgium	2016648921.jpg	http://www.loc.gov/item/2016648921/
spalato, the shore and francisco giuseppe's fountain, dalmatia, austro-hungary	1890	Austro-Hungary	2002710821.jpg	http://www.loc.gov/item/2002710821/
san geremia church, venice, italy	1890	Italy	2001701069.jpg	http://www.loc.gov/item/2001701069/
